{
  "schema_version": "capability-envelope-v1",
  "envelope_id": "wiki-node-production-capability",
  "version": "1.1.0",
  "scope": {
    "domain": "wiki-node-production"
  },
  "capability_id": "wiki-node-evidence-and-alignment",
  "runtime_fingerprint": {
    "model": "agent-set@sha256:a159ee391fd6148daf97f96049df980eb180750158fdc57f124129e2724f9dfe",
    "prompt": "prompt-set@sha256:8f028f278efc81025c9c368c451707f1036a00b46e75a4fc164a18794447e741",
    "toolset": "capability-set@sha256:5368be1c6acc2b0dd47f095d07b6b96b12abb8ae0e45634216b68d52fac4cddb",
    "workflow": "wiki-node-production@9"
  },
  "input_scope": {
    "industry": [
      "ict_equipment",
      "ICT设备制造"
    ],
    "nodes": [
      "A039"
    ],
    "publication_mode": [
      "reviewed"
    ]
  },
  "budget": {
    "max_model_calls": 100,
    "max_tool_calls": 400,
    "max_wall_seconds": 7200
  },
  "certification": {
    "status": "shadow",
    "evidence_refs": [
      "fixture://wiki-node-governance-cohort-v1/report"
    ],
    "cohort_id": "wiki-node-governance-cohort-v1",
    "sample_size": 200,
    "coverage": 0.62,
    "selective_risk_upper_bound": 0.015,
    "abstention_recall": 0.95,
    "valid_until": "2027-08-18T00:00:00Z"
  },
  "known_failures": [
    "mixed_functional_unit",
    "undocumented_allocation",
    "unfrozen_scanned_table",
    "novel_process_family"
  ],
  "fallback": {
    "terminal_state": "human_judgment_required",
    "reason": "Input or evidence lies outside the certified capability boundary."
  }
}
